{
  "id": "pages-only-001",
  "profile": "canonical-document",
  "description": "Pages without top-level text are valid.",
  "input": {
    "id": "d2",
    "pages": [
      {
        "pageNumber": 1,
        "text": "1ページ目"
      },
      {
        "pageNumber": 2,
        "text": "2ページ目"
      }
    ]
  },
  "expected": {
    "valid": true,
    "errors": [],
    "warnings": []
  }
}
